EstBERT,est-roberta,LaBSE,bertMulti,distilbertMulti,MiniLM_multi,MiniLM-L12_multi,multi_e5,xml_roberta,expected_amount,words
5,4,0,0,0,0,1,2,1,19,margaret; stuart; stewart; robert; prius; kuninglik; sõda; rahvuslik
5,4,0,0,0,0,1,2,1,19,margaret; stuart; stewart; robert; prius; kuninglik; sõda; rahvuslik
5,4,0,0,0,0,1,2,1,19,margaret; stuart; stewart; robert; prius; kuninglik; sõda; rahvuslik
5,4,0,0,0,0,1,2,1,19,margaret; stuart; stewart; robert; prius; kuninglik; sõda; rahvuslik
5,4,0,0,0,1,1,2,1,19,margaret; stuart; stewart; kilt; robert; prius; kuninglik; sõda; rahvuslik
4,5,0,0,0,0,0,2,1,19,margaret; stuart; stewart; püha; robert; prius; marie; sõda; rahvuslik
5,3,0,2,0,0,2,2,0,19,margaret; stuart; kilt; stewart; püha; robert; prius; marie; kuninglik; kroon; rahvuslik
3,0,0,3,0,1,1,2,0,19,prius; margaret; marie; stuart; kuninglik; stewart; püha; robert
1,1,1,2,0,1,0,4,0,19,prius; stewart; püha; sõda; robert; palee
2,0,1,2,0,0,0,1,1,19,stuart; stewart; robert; palee
2,1,3,1,1,2,0,3,1,19,margaret; stewart; püha; robert; palee; prius; sõda; rahvuslik
