EstBERT,est-roberta,LaBSE,bertMulti,distilbertMulti,MiniLM_multi,MiniLM-L12_multi,multi_e5,xml_roberta,expected_amount,words
1,1,3,0,1,0,1,0,0,12,hanno; hõff; pevkur; gruusia; euroopa; sammas
0,1,3,1,1,0,0,0,0,12,jaapan; hanno; hõff; pevkur; euroopa; sammas
0,1,3,1,1,0,0,0,1,12,jaapan; hanno; hõff; pevkur; euroopa; sammas
0,1,3,1,1,0,0,1,2,12,jaapan; hanno; hõff; pevkur; euroopa; sammas
0,3,4,1,1,0,0,1,2,12,pevkur; jaapan; hanno; hõff; euroopa; sammas
0,1,3,1,1,0,0,1,2,12,jaapan; hanno; hõff; pevkur; euroopa
0,2,3,3,1,0,1,2,2,12,hõff; gruusia; sammas; jaapan; hanno; pevkur; euroopa
0,0,3,4,1,0,0,2,2,12,jaapan; hanno; hõff; pevkur; euroopa; sammas
0,0,4,4,2,1,1,2,2,12,hõff; sammas; gruusia; jaapan; hanno; pevkur; euroopa
0,1,2,2,2,2,1,2,3,12,hõff; sammas; gruusia; jaapan; hanno; pevkur; euroopa
0,1,2,2,2,1,1,1,3,12,sammas; jaapan; hanno; hõff; pevkur; euroopa; gruusia
