EstBERT,est-roberta,LaBSE,bertMulti,distilbertMulti,MiniLM_multi,MiniLM-L12_multi,multi_e5,xml_roberta,expected_amount,words
1,1,1,1,3,1,0,0,3,15,mets; reimo; tõnis; eesti; geiaktivine; ühiskond; jurist; politsei
1,1,1,1,3,1,0,0,3,15,mets; reimo; tõnis; eesti; geiaktivine; ühiskond; jurist; politsei
1,2,1,1,3,1,0,0,3,15,mets; reimo; tõnis; eesti; geiaktivine; ühiskond; jurist; politsei
1,1,1,1,3,0,0,0,3,15,ühiskond; mets; reimo; jurist; politsei; eesti; geiaktivine
1,1,0,1,2,2,0,0,3,15,mets; ühiskond; reimo; jurist; politsei; eesti; geiaktivine
1,1,0,1,2,2,1,0,3,15,mets; ühiskond; reimo; jurist; politsei; eesti; geiaktivine
0,1,0,2,2,0,1,1,4,15,mets; kirik; ühiskond; jurist; politsei; eesti; geiaktivine
1,0,0,3,1,0,3,1,3,15,mets; kirik; reimo; eesti; geiaktivine; jurist; politsei
0,1,0,3,2,0,1,1,2,15,mets; kirik; reimo; jurist; eesti; politsei
1,1,0,2,2,0,0,1,4,15,kirik; jurist; eesti; haridus
1,1,0,2,2,0,0,1,3,15,kirik; jurist; eesti; haridus
