EstBERT,est-roberta,LaBSE,bertMulti,distilbertMulti,MiniLM_multi,MiniLM-L12_multi,multi_e5,xml_roberta,expected_amount,words
2,0,1,1,1,3,3,1,0,14,tallinna; probleem; saladus; kunstihoone; infotankistid; näitus
2,0,1,1,1,3,3,1,0,14,tallinna; probleem; saladus; kunstihoone; infotankistid; näitus
2,0,1,1,1,3,3,1,0,14,tallinna; probleem; saladus; kunstihoone; infotankistid; näitus
2,0,0,1,1,3,3,3,0,14,tallinna; mäng; kunstihoone; infotankistid; probleem; näitus
2,0,0,1,1,1,3,1,0,14,tallinna; kunstihoone; infotankistid; probleem; näitus
2,0,0,1,1,2,2,1,0,14,tallinna; kunstihoone; infotankistid; probleem
1,0,0,2,1,1,2,2,0,14,anders; infotankistid; probleem; näitus
0,1,1,0,1,0,2,3,0,14,tallinna; anders; kunstihoone; infotankistid; probleem; näitus
0,0,2,1,1,1,1,3,0,14,kunstihoone; infotankistid; probleem; näitus; akvarell
0,1,2,1,1,0,0,3,0,14,tallinna; infotankistid; probleem; näitus; akvarell
0,0,1,0,1,0,0,2,0,14,kunstihoone; infotankistid; probleem
