EstBERT,est-roberta,LaBSE,bertMulti,distilbertMulti,MiniLM_multi,MiniLM-L12_multi,multi_e5,xml_roberta,expected_amount,words
2,1,2,0,0,2,1,2,1,15,kilingi-nõmme; hendrik; maletaja; eesti; võistkond; olde
2,1,2,0,0,2,1,2,1,15,kilingi-nõmme; hendrik; maletaja; eesti; võistkond; olde
2,1,2,0,0,2,1,2,1,15,kilingi-nõmme; hendrik; maletaja; eesti; võistkond; olde
2,1,2,0,0,2,1,2,1,15,kilingi-nõmme; hendrik; maletaja; eesti; võistkond; olde
0,0,2,0,0,1,2,1,1,15,kilingi-nõmme; hendrik; eesti; olde
0,0,3,0,0,2,3,2,1,15,kilingi-nõmme; paul; hendrik; maletaja; eesti; olde
1,0,3,1,0,3,4,1,1,15,kilingi-nõmme; paul; hendrik; eesti; malering; olde
1,0,6,2,0,2,4,1,1,15,paul; klubi; eesti; kilingi-nõmme; hendrik; maletaja; keres; malering; olde
1,0,5,1,0,2,4,0,1,15,paul; eesti; kilingi-nõmme; hendrik; keres; malering; olde
0,0,5,1,0,2,3,3,1,15,turniir; paul; klubi; eesti; partii; hendrik; keres; malering; olde
0,0,4,0,0,2,2,2,1,15,paul; hendrik; klubi; eesti; malering; võistkond; partii; olde
