EstBERT,est-roberta,LaBSE,bertMulti,distilbertMulti,MiniLM_multi,MiniLM-L12_multi,multi_e5,xml_roberta,expected_amount,words
1,0,3,0,0,1,3,0,0,12,tarand; tahvel; mari; kadakas; esimene
1,0,3,0,0,1,3,0,0,12,tarand; tahvel; mari; kadakas; esimene
1,0,3,0,0,1,3,0,0,12,tarand; tahvel; mari; kadakas; esimene
1,0,2,0,0,1,3,0,0,12,tarand; tahvel; mari; kadakas
1,0,2,0,0,2,3,0,0,12,tarand; tahvel; mari; kadakas
1,0,2,0,0,3,3,1,0,12,tarand; tahvel; mari; kadakas; sõna
1,0,2,0,0,3,3,0,0,12,tarand; tahvel; mari; kadakas
0,1,2,0,0,3,3,0,0,12,tarand; mari; kadakas; sõna
0,0,2,0,1,3,1,1,0,12,aabits; tarand; mari; kadakas; esimene
0,1,2,0,0,3,2,2,0,12,aabits; tarand; lugu; mari; kadakas; sõna
0,0,1,1,0,2,1,0,1,12,kadakas; tarand; mari; raha
