EstBERT,est-roberta,LaBSE,bertMulti,distilbertMulti,MiniLM_multi,MiniLM-L12_multi,multi_e5,xml_roberta,expected_amount,words
1,1,2,0,1,1,1,0,0,15,looduskaitseala; alfa; alam-pedja
1,1,2,0,1,1,1,0,0,15,looduskaitseala; alfa; alam-pedja
1,1,2,0,1,1,1,0,0,15,looduskaitseala; alfa; alam-pedja
1,1,1,0,1,1,1,0,0,15,looduskaitseala; alfa; alam-pedja
1,0,3,0,1,1,1,0,0,15,looduskaitseala; alfa; alam-pedja; ilmar
1,0,2,0,1,0,1,0,0,15,marko; kübarsepp; alfa; alam-pedja
1,0,3,1,1,1,1,0,0,15,marko; alfa; alam-pedja; jahimees; ilmar
1,0,3,0,1,3,1,1,0,15,marko; alfa; kutsikas; alam-pedja; rootsi; hunt
1,0,2,0,1,3,1,1,0,15,marko; alfa; alam-pedja; rootsi; hunt
0,0,4,0,1,3,0,2,0,15,marko; ilmar; looduskaitseala; alfa; alam-pedja; rootsi; hunt
0,0,3,0,1,1,1,3,0,15,marko; kübarsepp; kutsikas; looduskaitseala; alfa; alam-pedja; rootsi; hunt
