EstBERT,est-roberta,LaBSE,bertMulti,distilbertMulti,MiniLM_multi,MiniLM-L12_multi,multi_e5,xml_roberta,expected_amount,words
2,2,3,2,3,1,2,5,3,13,talv; uno; sümpaatne; loop; eesti; austraalia; habe; mees
2,2,3,2,3,1,2,5,3,13,talv; uno; sümpaatne; loop; eesti; austraalia; habe; mees
2,2,3,2,3,1,2,5,3,13,talv; uno; sümpaatne; loop; eesti; austraalia; habe; mees
2,2,3,2,3,1,2,5,3,13,talv; uno; sümpaatne; loop; eesti; austraalia; habe; mees
3,2,2,2,3,1,2,4,3,13,talv; uno; sümpaatne; eesti; loop; austraalia; habe; mees
2,2,2,2,3,0,0,4,3,13,talv; uno; eesti; loop; austraalia; habe; mees
2,0,2,1,3,0,0,4,3,13,talv; uno; loop; eesti; austraalia; habe; mees
2,1,2,5,3,3,2,4,4,13,talv; uno; sümpaatne; eesti; loop; pere; habe; mees
4,2,3,5,3,1,0,3,4,13,talv; uno; tammer; eesti; austraalia; loop; enno; pere; habe; mees
6,2,3,4,4,3,1,3,4,13,talv; uno; tammer; sümpaatne; eesti; austraalia; loop; enno; pere; habe; mees
5,3,2,4,4,2,3,2,2,13,talv; uno; tammer; eesti; austraalia; loop; enno; pere; habe; mees
