EstBERT,est-roberta,LaBSE,bertMulti,distilbertMulti,MiniLM_multi,MiniLM-L12_multi,multi_e5,xml_roberta,expected_amount,words
0,0,1,0,0,2,2,1,1,16,sümfooniaorkester; kontsert; eesti; akustika
0,0,1,0,0,2,2,1,1,16,sümfooniaorkester; kontsert; eesti; akustika
0,0,1,0,0,2,2,1,1,16,sümfooniaorkester; kontsert; eesti; akustika
0,0,1,0,0,2,2,1,1,16,sümfooniaorkester; kontsert; eesti; akustika
0,0,2,0,0,2,2,2,1,16,sümfooniaorkester; kontsert; akustika; eesti; läänemere
0,0,2,0,0,3,1,1,1,16,sümfooniaorkester; kontsert; eesti; akustika
0,0,1,0,0,1,1,0,1,16,sümfooniaorkester; eesti; akustika
0,0,4,2,0,3,1,0,1,16,festival; kontsert; stravinski; eesti; läänemere; sümfooniaorkester; kontserdisaal; akustika
0,1,3,2,0,1,0,0,1,16,festival; kontsert; stravinski; eesti; akustika; läänemere
0,0,3,0,0,2,1,1,1,16,festival; sümfooniaorkester; kontsert; stravinski; eesti; akustika
0,0,1,0,0,1,1,0,1,16,festival; eesti; akustika; stravinski
