EstBERT,est-roberta,LaBSE,bertMulti,distilbertMulti,MiniLM_multi,MiniLM-L12_multi,multi_e5,xml_roberta,expected_amount,words
0,3,3,1,0,2,1,1,0,10,töö; raha; keskkool; eriala; raadio
0,3,3,1,0,2,1,1,0,10,töö; raha; keskkool; eriala; raadio
0,3,3,1,0,2,1,1,0,10,töö; raha; keskkool; eriala; raadio
0,3,3,1,0,2,1,1,0,10,töö; raha; keskkool; eriala; raadio
0,2,2,1,0,0,2,1,0,10,raha; keskkool; eriala; raadio
0,2,1,1,0,2,0,1,0,10,raha; eriala; tele; raadio
0,3,1,0,0,2,0,0,0,10,töö; raha; eriala; tele; raadio
0,2,1,0,0,1,0,0,0,10,eriala; raha; armastus; raadio
0,2,2,0,0,2,0,0,0,10,raha; eriala; armastus; raadio
0,1,0,0,0,0,0,0,0,10,eriala
0,1,0,0,1,0,0,0,0,10,eriala; armastus
