EstBERT,est-roberta,LaBSE,bertMulti,distilbertMulti,MiniLM_multi,MiniLM-L12_multi,multi_e5,xml_roberta,expected_amount,words
5,2,4,5,0,3,3,9,1,15,vaher; margus; birgit; superstaari; välismaa; eurolaul; eesti; eurovisioon; auhind; otsib; õigemeel
5,2,4,5,0,3,3,9,1,15,vaher; margus; birgit; superstaari; välismaa; eurolaul; eesti; eurovisioon; auhind; otsib; õigemeel
5,2,4,5,0,3,3,9,1,15,vaher; margus; birgit; superstaari; välismaa; eurolaul; eesti; eurovisioon; auhind; otsib; õigemeel
5,2,4,5,0,3,3,9,1,15,vaher; margus; birgit; superstaari; välismaa; eurolaul; eesti; eurovisioon; auhind; otsib; õigemeel
5,1,4,5,0,3,3,10,1,15,vaher; margus; birgit; superstaari; eurolaul; eesti; eurovisioon; auhind; otsib; õigemeel
5,4,6,4,0,4,3,12,1,15,vaher; margus; kerli; birgit; superstaari; kontsert; välismaa; eurovisioon; eesti; eurolaul; kõiv; auhind; otsib; õigemeel
6,1,4,3,0,4,2,11,1,15,vaher; margus; kerli; birgit; superstaari; kõiv; eurovisioon; eesti; eurolaul; auhind; otsib; õigemeel
4,3,4,2,0,5,2,7,1,15,kontsert; kõiv; eurolaul; eurovisioon; eesti; vaher; laul; auhind; margus; kerli; õigemeel; birgit; superstaari
4,2,3,5,0,4,2,4,1,15,kõiv; eurolaul; eesti; vaher; auhind; margus; otsib; kerli; õigemeel; birgit; superstaari
4,2,2,4,1,4,4,4,1,15,eurolaul; eesti; eurovisioon; vaher; auhind; margus; otsib; õigemeel; birgit; superstaari
4,1,1,5,1,3,4,2,1,15,kõiv; eurolaul; eesti; eurovisioon; laul; vaher; margus; auhind; kerli; õigemeel; birgit
