EstBERT,est-roberta,LaBSE,bertMulti,distilbertMulti,MiniLM_multi,MiniLM-L12_multi,multi_e5,xml_roberta,expected_amount,words
1,4,0,0,0,2,0,1,2,15,eve; hando; muusikaõpetaja; kontsertorkester; virumaa; dirigent; sümfooniaorkester; luha
1,4,0,0,0,2,0,1,1,15,sümfooniaorkester; eve; hando; muusikaõpetaja; luha; kontsertorkester; virumaa; dirigent
1,4,0,0,0,2,0,1,1,15,sümfooniaorkester; eve; hando; muusikaõpetaja; luha; kontsertorkester; virumaa; dirigent
1,4,0,0,0,2,0,1,1,15,sümfooniaorkester; eve; hando; muusikaõpetaja; luha; kontsertorkester; virumaa; dirigent
1,4,0,0,0,2,0,1,1,15,sümfooniaorkester; eve; hando; muusikaõpetaja; luha; kontsertorkester; virumaa; dirigent
1,3,1,0,0,2,1,1,1,15,sümfooniaorkester; eve; hando; luha; kontsertorkester; virumaa; dirigent
1,4,0,1,0,2,1,1,1,15,eve; laps; hando; kontsertorkester; virumaa; dirigent; sümfooniaorkester; luha; valdur
0,4,1,0,0,2,2,4,1,15,eve; muusikaõpetaja; muusikakool; kontsertorkester; virumaa; dirigent; põldmäe; luha; valdur
0,2,1,2,0,2,1,3,1,15,laps; muusikaõpetaja; kontsertorkester; virumaa; liiv; dirigent; luha; valdur
0,1,3,2,0,2,0,3,1,15,laps; muusikaõpetaja; rakvere; kontsertorkester; virumaa; dirigent; valdur
0,1,1,1,0,2,0,5,1,15,laps; muusikaõpetaja; rakvere; kontsertorkester; virumaa; dirigent; sümfooniaorkester; valdur
