EstBERT,est-roberta,LaBSE,bertMulti,distilbertMulti,MiniLM_multi,MiniLM-L12_multi,multi_e5,xml_roberta,expected_amount,words
1,2,2,0,1,1,1,1,0,10,režissöör; televisioon; direktor; saade; toimetus
1,2,2,0,1,1,1,1,0,10,režissöör; televisioon; direktor; saade; toimetus
1,2,2,0,1,1,1,1,0,10,režissöör; televisioon; direktor; saade; toimetus
1,2,2,0,1,1,1,1,0,10,režissöör; televisioon; direktor; saade; toimetus
1,2,1,0,1,1,1,1,0,10,režissöör; televisioon; direktor; saade; toimetus
1,2,1,0,1,2,2,0,0,10,režissöör; koosolek; televisioon; direktor; toimetus
1,2,2,0,1,2,2,2,0,10,režissöör; toimetus; televisioon; direktor; saade; koosolek
1,2,0,0,0,2,2,3,0,10,režissöör; stuudio; televisioon; direktor; koosolek
0,2,1,0,1,2,2,2,0,10,režissöör; stuudio; koosolek; televisioon; direktor; toimetus
0,0,0,0,0,2,2,2,0,10,televisioon; režissöör; stuudio; koosolek
1,0,1,1,0,3,2,3,0,10,režissöör; stuudio; televisioon; koosolek
