EstBERT,est-roberta,LaBSE,bertMulti,distilbertMulti,MiniLM_multi,MiniLM-L12_multi,multi_e5,xml_roberta,expected_amount,words
0,1,2,0,2,0,0,0,0,18,teater; mälberg; annely; mall
0,1,2,0,2,0,0,0,0,18,teater; mälberg; annely; mall
0,1,2,0,2,0,0,0,0,18,teater; mälberg; annely; mall
0,1,1,0,2,0,0,0,0,18,teater; mälberg; annely; mall
0,1,1,0,2,1,0,0,0,18,annely; andres; teater; mälberg; mall
0,0,1,0,2,0,0,0,0,18,mälberg; annely; mall
0,0,1,0,2,2,0,0,0,18,annely; peebo; mälberg; mall
0,0,2,0,2,1,0,0,0,18,peebo; annely; mälberg; mall
0,0,1,0,2,1,0,0,0,18,mälberg; peebo; annely; mall
0,0,1,0,2,0,0,0,0,18,mälberg; annely; mall
0,0,1,0,1,0,1,0,0,18,mälberg; peebo; hele
