EstBERT,est-roberta,LaBSE,bertMulti,distilbertMulti,MiniLM_multi,MiniLM-L12_multi,multi_e5,xml_roberta,expected_amount,words
0,3,2,1,0,0,1,1,3,12,suitsetamine; mäng; afganistan; liit; teater; süda; näitus; moskva
0,3,0,1,0,0,1,1,3,12,suitsetamine; mäng; afganistan; liit; teater; näitus; moskva
0,2,0,1,0,0,1,1,3,12,suitsetamine; mäng; afganistan; liit; teater; näitus; moskva
0,2,0,1,0,0,1,1,3,12,suitsetamine; mäng; afganistan; liit; teater; näitus; moskva
0,2,0,0,0,1,1,2,3,12,suitsetamine; afganistan; liit; mäng; teater; moskva
0,2,1,0,0,1,0,1,3,12,iraan; suitsetamine; afganistan; mäng; teater; süda; moskva
0,1,1,0,1,3,0,1,2,12,suitsetamine; afganistan; mäng; süda; moskva
0,0,0,2,1,3,0,0,1,12,suitsetamine; afganistan; mäng; moskva
0,0,1,3,1,0,1,0,1,12,suitsetamine; afganistan; teater; moskva
0,1,1,2,1,2,0,1,1,12,iraan; suitsetamine; afganistan; mäng; teater
1,1,0,2,0,1,1,1,0,12,iraan; suitsetamine; afganistan; teater; moskva
