EstBERT,est-roberta,LaBSE,bertMulti,distilbertMulti,MiniLM_multi,MiniLM-L12_multi,multi_e5,xml_roberta,expected_amount,words
1,3,0,1,1,0,0,2,3,15,ühiskond; kirik; reimo; jurist; eesti; geiaktivine
1,3,0,1,1,0,0,2,2,15,ühiskond; kirik; reimo; jurist; eesti; geiaktivine
1,3,0,1,1,0,0,2,2,15,ühiskond; kirik; reimo; jurist; eesti; geiaktivine
1,3,0,1,1,0,0,3,2,15,ühiskond; kirik; reimo; jurist; eesti; geiaktivine
1,3,1,0,1,0,0,3,2,15,ühiskond; kirik; reimo; jurist; eesti; geiaktivine
1,3,2,2,1,1,0,4,2,15,kirik; reimo; tõnis; eesti; geiaktivine; ühiskond; jurist
2,2,1,1,1,2,1,4,3,15,kirik; mets; reimo; tõnis; eesti; haridus; geiaktivine; ühiskond; jurist; politsei
2,1,3,1,1,1,1,6,4,15,kirik; mets; reimo; tõnis; eesti; ühiskond; jurist; politsei
1,0,0,1,1,1,2,5,4,15,mets; kirik; reimo; tõnis; eesti; haridus; ühiskond; jurist
0,0,1,1,2,1,3,4,2,15,mets; kirik; reimo; tõnis; eesti; ühiskond; jurist
1,1,1,2,2,1,3,4,2,15,mets; kirik; reimo; tõnis; eesti; jurist
