EstBERT,est-roberta,LaBSE,bertMulti,distilbertMulti,MiniLM_multi,MiniLM-L12_multi,multi_e5,xml_roberta,expected_amount,words
0,1,2,0,0,5,5,1,0,16,estonia; teater; eesti; pianiino; klaver
0,1,2,0,0,5,5,1,0,16,estonia; teater; eesti; pianiino; klaver
0,1,2,0,0,5,5,1,1,16,estonia; teater; eesti; pianiino; klaver
0,1,2,0,0,5,5,1,1,16,estonia; teater; eesti; pianiino; klaver
0,1,3,0,0,5,5,1,1,16,klaver; estonia; teater; tomson; eesti; pianiino
0,1,3,0,0,5,5,1,1,16,estonia; alo; teater; klaver; tomson; eesti; pianiino
0,1,3,0,0,3,2,0,1,16,estonia; alo; teater; tomson; pianiino
0,1,3,0,0,1,2,0,2,16,estonia; teater; tomson; pianiino; eesti
0,1,3,1,0,0,2,1,2,16,estonia; klaver; teater; tomson; pianiino; eesti
0,1,1,2,0,0,2,1,2,16,estonia; klaver; teater; tomson; pianiino; eesti
0,1,3,2,0,0,1,0,2,16,estonia; teater; tomson; eesti
