EstBERT,est-roberta,LaBSE,bertMulti,distilbertMulti,MiniLM_multi,MiniLM-L12_multi,multi_e5,xml_roberta,expected_amount,words
0,1,1,0,0,1,0,0,1,16,muusikamuuseum; eesti; estonia
0,1,1,0,0,1,0,0,2,16,teatri-; muusikamuuseum; eesti; estonia
0,1,1,0,0,1,0,0,2,16,teatri-; muusikamuuseum; eesti; estonia
0,1,1,0,0,1,0,0,2,16,teatri-; muusikamuuseum; eesti; estonia
0,1,1,0,0,1,0,0,2,16,teatri-; muusikamuuseum; eesti; estonia
0,2,1,0,0,1,0,0,2,16,muusikamuuseum; estonia; teatri-; eesti; tiibklaver
0,2,1,0,0,1,0,2,2,16,muusikamuuseum; estonia; teatri-; eesti; tiibklaver; klaveriehitus
0,2,1,0,0,1,3,2,2,16,muusikamuuseum; estonia; klaverimeister; teatri-; eesti; tiibklaver; klaveriehitus
0,2,1,1,0,2,1,0,2,16,muusikamuuseum; tsentraliseerimine; estonia; teatri-; eesti
0,1,1,0,0,2,1,0,2,16,muusikamuuseum; estonia; teatri-; eesti
0,1,1,1,0,2,1,0,2,16,muusikamuuseum; estonia; teatri-; pianiino; eesti
