EstBERT,est-roberta,LaBSE,bertMulti,distilbertMulti,MiniLM_multi,MiniLM-L12_multi,multi_e5,xml_roberta,expected_amount,words
2,2,3,0,3,3,3,3,1,14,institutsioon; sümboolne; võim; kunstnik; maria-kristiina; kriitik; kuraator; publik; liit; reaalne
2,2,3,0,3,4,3,4,1,14,institutsioon; sümboolne; võim; kunstnik; maria-kristiina; kriitik; kuraator; publik; liit; reaalne
2,2,2,0,3,4,3,4,1,14,institutsioon; sümboolne; võim; kunstnik; maria-kristiina; kriitik; kuraator; publik; liit; reaalne
2,2,1,0,2,4,3,4,1,14,institutsioon; sümboolne; maria-kristiina; kunstnik; kriitik; kuraator; publik; liit; reaalne
2,2,1,0,3,3,3,4,1,14,institutsioon; sümboolne; võim; maria-kristiina; kunstnik; kriitik; kuraator; publik; liit; reaalne
2,2,1,0,2,4,3,4,1,14,institutsioon; sümboolne; maria-kristiina; kunstnik; kriitik; kuraator; härm; publik; liit; reaalne
1,3,3,2,1,1,2,4,1,14,institutsioon; kunstnik; maria-kristiina; kriitik; liit; reaalne
0,3,2,2,1,1,2,6,1,14,institutsioon; võim; maria-kristiina; kunstnik; kriitik; kuraator; publik; liit
0,2,1,0,0,4,1,4,1,14,kriitik; kunstnik; publik; institutsioon; võim; maria-kristiina
1,1,2,0,3,1,1,2,1,14,kriitik; härm; maria-kristiina; võim; kunstnik
0,1,3,0,2,1,0,2,2,14,kriitik; härm; liit; maria-kristiina; võim; kunstnik
