EstBERT,est-roberta,LaBSE,bertMulti,distilbertMulti,MiniLM_multi,MiniLM-L12_multi,multi_e5,xml_roberta,expected_amount,words
4,4,1,2,3,2,0,5,0,18,andres; kanter; arst; orel; gerd; mall; uibo; annely; peebo; mälberg; anu
4,4,3,2,3,2,0,5,0,18,andres; kanter; arst; orel; gerd; mall; uibo; annely; peebo; mälberg; anu
4,4,3,2,4,2,0,5,0,18,andres; hele; kanter; arst; orel; gerd; mall; uibo; annely; peebo; mälberg; anu
4,3,4,2,4,2,2,5,0,18,andres; hele; arst; orel; mall; annely; uibo; gerd; peebo; mälberg; anu
3,3,4,3,4,2,3,7,0,18,andres; hele; kanter; mall; annely; gerd; peebo; uibo; mälberg; anu; everaus
3,3,5,5,5,2,2,7,0,18,kanter; annely; peebo; uibo; anu; andres; hele; lamp; orel; mall; gerd; mälberg; everaus
4,1,8,2,7,3,3,8,1,18,kanter; annely; peebo; uibo; anu; kettaheide; hele; orel; mall; gerd; mälberg; everaus
2,2,4,4,8,5,4,8,2,18,kanter; annely; peebo; uibo; anu; andres; hele; lamp; orel; mall; gerd; mälberg; everaus
2,2,5,5,10,7,2,9,2,18,kanter; arst; annely; peebo; uibo; anu; andres; kettaheide; hele; lamp; orel; mall; mälberg; everaus
3,4,9,6,8,9,3,9,2,18,kanter; arst; annely; uibo; peebo; anu; andres; kettaheide; hele; lamp; orel; gerd; mall; mälberg; everaus
3,2,8,6,8,6,2,8,3,18,kanter; arst; annely; peebo; uibo; anu; andres; kettaheide; hele; lamp; orel; mall; mälberg; everaus
