EstBERT,est-roberta,LaBSE,bertMulti,distilbertMulti,MiniLM_multi,MiniLM-L12_multi,multi_e5,xml_roberta,expected_amount,words
3,2,1,3,0,3,6,1,0,13,merilai; pehk; oidipus; jaan; luulekogu; arvumaagia; r端tm; krull
3,1,1,3,0,3,7,1,0,13,merilai; pehk; oidipus; jaan; arne; luulekogu; arvumaagia; krull
3,1,1,3,0,3,7,1,0,13,merilai; pehk; oidipus; jaan; arne; luulekogu; arvumaagia; krull
1,2,1,3,0,3,7,1,0,13,merilai; pehk; oidipus; jaan; arne; luulekogu; arvumaagia; krull
0,1,2,3,0,3,7,1,0,13,merilai; hasso; pehk; oidipus; jaan; arne; luulekogu; arvumaagia; krull
0,1,3,3,2,3,6,1,0,13,merilai; hasso; pehk; oidipus; jaan; luulekogu; arvumaagia; r端tm; krull
1,1,4,1,3,3,4,1,0,13,merilai; hasso; jaan; arne; luulekogu; r端tm; krull
0,1,5,1,2,3,2,1,0,13,merilai; hasso; pehk; jaan; arne; luulekogu; krull
1,2,4,1,2,2,1,1,0,13,jaan; merilai; arne; luulekogu; hasso; pehk; krull
1,2,3,1,4,3,4,2,0,13,merilai; hasso; pehk; jaan; luulekogu; r端tm; krull
1,2,3,1,4,3,3,2,0,13,merilai; hasso; pehk; jaan; luulekogu; krull
